{
  "segment": 4,
  "towns": [
    "Meyssac"
  ],
  "climbs": [
    "Puy Boubou"
  ],
  "image_count": 50,
  "images": [
    {
      "title": "File:Maison Verdès 01.jpg",
      "url": "https://upload.wikimedia.org/wikipedia/commons/thumb/e/ea/Maison_Verd%C3%A8s_01.jpg/960px-Maison_Verd%C3%A8s_01.jpg",
      "full_url": "https://upload.wikimedia.org/wikipedia/commons/e/ea/Maison_Verd%C3%A8s_01.jpg",
      "description_url": "https://commons.wikimedia.org/wiki/File:Maison_Verd%C3%A8s_01.jpg",
      "width": 5794,
      "height": 3868,
      "license": "CC BY-SA 4.0",
      "artist": "<a href=\"//commons.wikimedia.org/wiki/User:A1AA1A\" title=\"User:A1AA1A\">A1AA1A</a>",
      "description": "Maison Verdès ou Verdier"
    },
    {
      "title": "File:Meyssac - Église 02.jpg",
      "url": "https://upload.wikimedia.org/wikipedia/commons/thumb/9/97/Meyssac_-_%C3%89glise_02.jpg/960px-Meyssac_-_%C3%89glise_02.jpg",
      "full_url": "https://upload.wikimedia.org/wikipedia/commons/9/97/Meyssac_-_%C3%89glise_02.jpg",
      "description_url": "https://commons.wikimedia.org/wiki/File:Meyssac_-_%C3%89glise_02.jpg",
      "width": 5794,
      "height": 3868,
      "license": "CC BY-SA 4.0",
      "artist": "<a href=\"//commons.wikimedia.org/wiki/User:A1AA1A\" title=\"User:A1AA1A\">A1AA1A</a>",
      "description": "Église Saint-Vincent de Meyssac"
    },
    {
      "title": "File:Castel de Maussac.jpg",
      "url": "https://upload.wikimedia.org/wikipedia/commons/thumb/4/41/Castel_de_Maussac.jpg/960px-Castel_de_Maussac.jpg",
      "full_url": "https://upload.wikimedia.org/wikipedia/commons/4/41/Castel_de_Maussac.jpg",
      "description_url": "https://commons.wikimedia.org/wiki/File:Castel_de_Maussac.jpg",
      "width": 5794,
      "height": 3868,
      "license": "CC BY-SA 4.0",
      "artist": "<a href=\"//commons.wikimedia.org/wiki/User:A1AA1A\" title=\"User:A1AA1A\">A1AA1A</a>",
      "description": "Castel de Maussac"
    },
    {
      "title": "File:Collonges - Beauvirie.jpg",
      "url": "https://upload.wikimedia.org/wikipedia/commons/thumb/1/11/Collonges_-_Beauvirie.jpg/960px-Collonges_-_Beauvirie.jpg",
      "full_url": "https://upload.wikimedia.org/wikipedia/commons/1/11/Collonges_-_Beauvirie.jpg",
      "description_url": "https://commons.wikimedia.org/wiki/File:Collonges_-_Beauvirie.jpg",
      "width": 5794,
      "height": 3868,
      "license": "CC BY-SA 4.0",
      "artist": "<a href=\"//commons.wikimedia.org/wiki/User:A1AA1A\" title=\"User:A1AA1A\">A1AA1A</a>",
      "description": "Manoir de Beauvirie"
    },
    {
      "title": "File:Collonges - Maussac.jpg",
      "url": "https://upload.wikimedia.org/wikipedia/commons/thumb/1/19/Collonges_-_Maussac.jpg/960px-Collonges_-_Maussac.jpg",
      "full_url": "https://upload.wikimedia.org/wikipedia/commons/1/19/Collonges_-_Maussac.jpg",
      "description_url": "https://commons.wikimedia.org/wiki/File:Collonges_-_Maussac.jpg",
      "width": 5794,
      "height": 3868,
      "license": "CC BY-SA 4.0",
      "artist": "<a href=\"//commons.wikimedia.org/wiki/User:A1AA1A\" title=\"User:A1AA1A\">A1AA1A</a>",
      "description": "Castel de Maussac"
    },
    {
      "title": "File:Maison Verdès 02.jpg",
      "url": "https://upload.wikimedia.org/wikipedia/commons/thumb/7/77/Maison_Verd%C3%A8s_02.jpg/960px-Maison_Verd%C3%A8s_02.jpg",
      "full_url": "https://upload.wikimedia.org/wikipedia/commons/7/77/Maison_Verd%C3%A8s_02.jpg",
      "description_url": "https://commons.wikimedia.org/wiki/File:Maison_Verd%C3%A8s_02.jpg",
      "width": 5424,
      "height": 3616,
      "license": "CC BY-SA 4.0",
      "artist": "<a href=\"//commons.wikimedia.org/wiki/User:A1AA1A\" title=\"User:A1AA1A\">A1AA1A</a>",
      "description": "Maison Verdès ou Verdier"
    },
    {
      "title": "File:Meyssac - Église 01.jpg",
      "url": "https://upload.wikimedia.org/wikipedia/commons/thumb/4/41/Meyssac_-_%C3%89glise_01.jpg/960px-Meyssac_-_%C3%89glise_01.jpg",
      "full_url": "https://upload.wikimedia.org/wikipedia/commons/4/41/Meyssac_-_%C3%89glise_01.jpg",
      "description_url": "https://commons.wikimedia.org/wiki/File:Meyssac_-_%C3%89glise_01.jpg",
      "width": 5306,
      "height": 3542,
      "license": "CC BY-SA 4.0",
      "artist": "<a href=\"//commons.wikimedia.org/wiki/User:A1AA1A\" title=\"User:A1AA1A\">A1AA1A</a>",
      "description": "Église Saint-Vincent de Meyssac"
    },
    {
      "title": "File:Meyssac - Halle.jpg",
      "url": "https://upload.wikimedia.org/wikipedia/commons/thumb/c/c4/Meyssac_-_Halle.jpg/960px-Meyssac_-_Halle.jpg",
      "full_url": "https://upload.wikimedia.org/wikipedia/commons/c/c4/Meyssac_-_Halle.jpg",
      "description_url": "https://commons.wikimedia.org/wiki/File:Meyssac_-_Halle.jpg",
      "width": 5273,
      "height": 3515,
      "license": "CC BY-SA 4.0",
      "artist": "<a href=\"//commons.wikimedia.org/wiki/User:A1AA1A\" title=\"User:A1AA1A\">A1AA1A</a>",
      "description": "Halle à grains de Meyssac et maison Verdès au second plan."
    },
    {
      "title": "File:Collonges - Maussac Porte.jpg",
      "url": "https://upload.wikimedia.org/wikipedia/commons/thumb/a/a7/Collonges_-_Maussac_Porte.jpg/960px-Collonges_-_Maussac_Porte.jpg",
      "full_url": "https://upload.wikimedia.org/wikipedia/commons/a/a7/Collonges_-_Maussac_Porte.jpg",
      "description_url": "https://commons.wikimedia.org/wiki/File:Collonges_-_Maussac_Porte.jpg",
      "width": 5087,
      "height": 3396,
      "license": "CC BY-SA 4.0",
      "artist": "<a href=\"//commons.wikimedia.org/wiki/User:A1AA1A\" title=\"User:A1AA1A\">A1AA1A</a>",
      "description": "Castel de Maussac"
    },
    {
      "title": "File:Collonges-la-Rouge (Corrèze). (29067286574).jpg",
      "url": "https://upload.wikimedia.org/wikipedia/commons/thumb/f/fe/Collonges-la-Rouge_%28Corr%C3%A8ze%29._%2829067286574%29.jpg/960px-Collonges-la-Rouge_%28Corr%C3%A8ze%29._%2829067286574%29.jpg",
      "full_url": "https://upload.wikimedia.org/wikipedia/commons/f/fe/Collonges-la-Rouge_%28Corr%C3%A8ze%29._%2829067286574%29.jpg",
      "description_url": "https://commons.wikimedia.org/wiki/File:Collonges-la-Rouge_(Corr%C3%A8ze)._(29067286574).jpg",
      "width": 4928,
      "height": 3264,
      "license": "CC BY 2.0",
      "artist": "<a rel=\"nofollow\" class=\"external text\" href=\"https://www.flickr.com/people/26082117@N07\">Daniel Jolivet</a>",
      "description": "<p>Collonges-la-Rouge (Corrèze).\n</p><p>La maison de Maussac.\n</p><p>En 1415, Aymar de Chaunac aurait rendu hommage au vicomte pour son hôtel de Maussac à Collonges. En fait, il semble qu'\"il s'agisse"
    },
    {
      "title": "File:Collonges-la-Rouge (Corrèze). (29068772943).jpg",
      "url": "https://upload.wikimedia.org/wikipedia/commons/thumb/8/8d/Collonges-la-Rouge_%28Corr%C3%A8ze%29._%2829068772943%29.jpg/960px-Collonges-la-Rouge_%28Corr%C3%A8ze%29._%2829068772943%29.jpg",
      "full_url": "https://upload.wikimedia.org/wikipedia/commons/8/8d/Collonges-la-Rouge_%28Corr%C3%A8ze%29._%2829068772943%29.jpg",
      "description_url": "https://commons.wikimedia.org/wiki/File:Collonges-la-Rouge_(Corr%C3%A8ze)._(29068772943).jpg",
      "width": 4928,
      "height": 3264,
      "license": "CC BY 2.0",
      "artist": "<a rel=\"nofollow\" class=\"external text\" href=\"https://www.flickr.com/people/26082117@N07\">Daniel Jolivet</a>",
      "description": "<p>Collonges-la-Rouge (Corrèze).\n</p><p>La maison de Maussac.\n</p><p>En 1415, Aymar de Chaunac aurait rendu hommage au vicomte pour son hôtel de Maussac à Collonges. En fait, il semble qu'\"il s'agisse"
    },
    {
      "title": "File:Collonges-la-Rouge (Corrèze). (29068808503).jpg",
      "url": "https://upload.wikimedia.org/wikipedia/commons/thumb/1/12/Collonges-la-Rouge_%28Corr%C3%A8ze%29._%2829068808503%29.jpg/960px-Collonges-la-Rouge_%28Corr%C3%A8ze%29._%2829068808503%29.jpg",
      "full_url": "https://upload.wikimedia.org/wikipedia/commons/1/12/Collonges-la-Rouge_%28Corr%C3%A8ze%29._%2829068808503%29.jpg",
      "description_url": "https://commons.wikimedia.org/wiki/File:Collonges-la-Rouge_(Corr%C3%A8ze)._(29068808503).jpg",
      "width": 4928,
      "height": 3264,
      "license": "CC BY 2.0",
      "artist": "<a rel=\"nofollow\" class=\"external text\" href=\"https://www.flickr.com/people/26082117@N07\">Daniel Jolivet</a>",
      "description": "<p>Collonges-la-Rouge (Corrèze).\n</p><p>La maison de Maussac.\n</p><p>En 1415, Aymar de Chaunac aurait rendu hommage au vicomte pour son hôtel de Maussac à Collonges. En fait, il semble qu'\"il s'agisse"
    },
    {
      "title": "File:Collonges-la-Rouge (Corrèze). (28433420170).jpg",
      "url": "https://upload.wikimedia.org/wikipedia/commons/thumb/0/0b/Collonges-la-Rouge_%28Corr%C3%A8ze%29._%2828433420170%29.jpg/960px-Collonges-la-Rouge_%28Corr%C3%A8ze%29._%2828433420170%29.jpg",
      "full_url": "https://upload.wikimedia.org/wikipedia/commons/0/0b/Collonges-la-Rouge_%28Corr%C3%A8ze%29._%2828433420170%29.jpg",
      "description_url": "https://commons.wikimedia.org/wiki/File:Collonges-la-Rouge_(Corr%C3%A8ze)._(28433420170).jpg",
      "width": 4928,
      "height": 3264,
      "license": "CC BY 2.0",
      "artist": "<a rel=\"nofollow\" class=\"external text\" href=\"https://www.flickr.com/people/26082117@N07\">Daniel Jolivet</a>",
      "description": "<p>Collonges-la-Rouge (Corrèze).\n</p><p>L'église Saint-Pierre.\n</p><p>Collonges aurait d'abord été un petit prieuré de l'abbaye de Charroux (\"Curia Coloniense\" citée dans le cartulaire de Charroux au "
    },
    {
      "title": "File:Collonges-la-Rouge (Corrèze). (29657961246).jpg",
      "url": "https://upload.wikimedia.org/wikipedia/commons/thumb/d/d7/Collonges-la-Rouge_%28Corr%C3%A8ze%29._%2829657961246%29.jpg/960px-Collonges-la-Rouge_%28Corr%C3%A8ze%29._%2829657961246%29.jpg",
      "full_url": "https://upload.wikimedia.org/wikipedia/commons/d/d7/Collonges-la-Rouge_%28Corr%C3%A8ze%29._%2829657961246%29.jpg",